<?xml version="1.0" encoding="UTF-8"?>
<xs:schema xmlns:xs="http://www.w3.org/2001/XMLSchema">
	<xs:element name="wizard-config">
		<xs:complexType>
			<xs:sequence>
				<xs:element name="displayed-properties" type="wizard-property-list" minOccurs="0" maxOccurs="1"/>
				<xs:element name="after-done-wizard-script" type="after-done-wizard-script" minOccurs="0" maxOccurs="1"/>    			
			</xs:sequence>
			<xs:attribute name="showPrefilledValues" type="xs:boolean" use="optional" default="false"/>
			<xs:attribute name="createMode" type="xs:boolean" use="optional" default="true"/>
			<xs:attribute name="selectMode" type="xs:boolean" use="optional" default="false"/>
			<xs:attribute name="displaySubtypes" type="xs:boolean" use="optional" default="true"/>
			<xs:attribute name="activateAfterCreate" type="xs:boolean" use="optional" default="false"/>
			<xs:attribute name="createWithinPopup" type="xs:boolean" use="optional" default="true"/>
			<xs:attribute name="createWithinEditor" type="xs:boolean" use="optional" default="true"/>
		</xs:complexType>
	</xs:element>	

	<xs:complexType name="wizard-property-list">
		<xs:sequence>
			<xs:element name="group" type="group" minOccurs="0" maxOccurs="unbounded"/>
			<xs:element name="property" type="property" minOccurs="0" maxOccurs="unbounded"/>
		</xs:sequence>
	</xs:complexType>
	
	<xs:complexType name="after-done-wizard-script">
		<xs:sequence>
			<xs:element name="content" type="xs:string" minOccurs="1" maxOccurs="1"/>
		</xs:sequence>
		<xs:attribute name="language" type="xs:string" use="required"/>
	</xs:complexType>
	
	<xs:complexType name="property">
		<xs:sequence>
			<xs:element name="parameter" type="parameter" minOccurs="0" maxOccurs="unbounded"/>
		</xs:sequence>
		<xs:attribute name="qualifier" type="xs:string" use="required"/>
		<xs:attribute name="editorCode" type="xs:string" use="optional"/>
		<xs:attribute name="visible" type="xs:boolean" use="optional" default="true"/>
	</xs:complexType>      
     
	<xs:complexType name="parameter">
		<xs:attribute name="name" type="xs:string" use="required"/>
		<xs:attribute name="value" type="xs:string" use="required"/>
	</xs:complexType>
	
	<xs:complexType name="group">
    	<xs:sequence>
    		<xs:element name="label" type="label" minOccurs="1" maxOccurs="unbounded"/>
    		<xs:element name="property" type="property" minOccurs="1" maxOccurs="unbounded"/>
    	</xs:sequence>
    	<xs:attribute name="qualifier" type="xs:string" use="required"/>
    	<xs:attribute name="visible" type="xs:boolean" use="optional" default="true"/>
    	<xs:attribute name="tabbed" type="xs:boolean" use="optional" default="false"/>
    	<xs:attribute name="initially-opened" type="xs:boolean" use="optional" default="true"/>
    	<xs:attribute name="show-if-empty" type="xs:boolean" use="optional" default="true"/>
    	<xs:attribute name="show-in-create-mode" type="xs:boolean" use="optional" default="true"/>
    	<xs:attribute name="position" type="xs:positiveInteger" use="optional" default="1"/>
    </xs:complexType>
    
    <xs:complexType name="label">
    	<xs:simpleContent>
    		<xs:extension base="xs:string">
    			<xs:attribute name="key" use="optional" type="xs:string" />
				<xs:attribute name="lang" use="optional" type="xs:string" />
    		</xs:extension>
    	</xs:simpleContent>
    </xs:complexType>
	
	
</xs:schema>